Q,A
"?","чего"
"чего","ничего"
"здравствуйте","здравствуйте"
"правила выпаса крупного рогатого скота","субъекты Российской Федерации вправе самостоятельно регулировать отдельные вопросы выпаса, выгула и прогона сельскохозяйственных животных в рамках правил по благоустройству территории муниципального образования"
"меры по ущербу при выпасе крупного рогатого скота","если пасущиеся бесконтрольно сельскохозяйственные животные причинили вред личности или имуществу физического или юридического лица, гражданин или юридическое лицо может обратиться в суд с иском о возмещение вреда."
"организация выпаса крупного рогатого скота","в целях выпаса сельскохозяйственных животных может устанавливаться публичный сервитут в порядке и на сроки, продолжительность которых соответствует местным условиям и обычаям."
"технология выращивания телят в животноводстве","в молочном скотоводстве «холодный метод» содержания предусматривает выращивание телят с первых дней жизни на открытом воздухе в легких индивидуальных домиках."
"срок содержания телят после рождения","в индивидуальных домиках молодняк содержат до 1,5 - 2 месяцев"
"где содержат телят после индивидуальных домиков","переводят в групповые домики по 12 - 15 голов, где они содержатся до 4 месяцев"
"где содержат телят от 4 месяцев и далее","от 4 месяцев и до 7 - 8-месячной стельности нетелей молодняк содержат на площадках, оборудованных навесами и местами отдыха с глубокой соломенной подстилкой."
"правила оборудования выгульных площадок","выгульные площадки, не имеющие сплошного твердого покрытия, оборудуются обязательным твердым покрытием вокруг поилок и кормушек."
"меры государственной поддержки скотоводства","гос. поддержка скотоводства в рамках гос. программы развития сельского хозяйства и регулирования рынков сх продукции, сырья и продовольствия, утвержденной постановлением Правительства РФ от 14.07.2012 № 717, осуществляется направлениям."
"государственная поддержка на строительство объектов в молочном скотоводстве","постановлением Правительства РФ от 24.11.2018 № 413 утверждены Правила ... на возмещение части прямых понесенных затрат на создание и (или) модернизацию объектов агропромышленного комплекса."
"рассмотрение проектов объектов в молочном скотоводстве","рассмотрение проектов осуществляется согласно Порядку отбора инвестиционных проектов, представленных сельскохозяйственными товаропроизводителям"
"какие направления существуют в поддержке скотоводства","повышение продуктивности в молочном скотоводстве; поддержка племенного молочного скотоводства; развитие мясного скотоводства;"
"какие направления существуют в поддержке малых форм хозяйствования","прирост производства молока; развитие специализированного мясного скотоводства; развитие малых форм хозяйствования (в виде грантов);грантовая поддержка."
"поддержка развития садоводства и питомниководства","в рамках Правил предоставления и  распределения субсидий из федерального бюджета на содействие достижению целевых показателей региональных программ развития агропромышленного комплекса, приведенных в приложении № 8 к Госпрограмме развития сх и регулирования рынков сельскохозяйственной продукции, сырья и продовольствия, утвержденной Постановлением Правительства Р от 14.07.2012 № 717."
"исключения при поддержке развития садоводства и питомниководства","за исключением граждан, ведущих личное подсобное хозяйство, и сельскохозяйственных кредитных потребительских кооперативов, а также организациям и индивидуальным предпринимателям, осуществляющим производство, первичную и (или) последующую (промышленную) переработку сельскохозяйственной продукции"
